[
 {
  "frame": 0,
  "x": 1203.838,
  "y": 490.008,
  "diameter": 0.0,
  "visibility": 0.0,
  "visible": false,
  "phase": "before"
 },
 {
  "frame": 1,
  "x": 1203.838,
  "y": 490.008,
  "diameter": 0.0,
  "visibility": 0.0,
  "visible": false,
  "phase": "before"
 },
 {
  "frame": 2,
  "x": 1203.838,
  "y": 490.008,
  "diameter": 0.0,
  "visibility": 0.0,
  "visible": false,
  "phase": "before"
 },
 {
  "frame": 3,
  "x": 1203.838,
  "y": 490.008,
  "diameter": 0.0,
  "visibility": 0.0,
  "visible": false,
  "phase": "before"
 },
 {
  "frame": 4,
  "x": 1203.838,
  "y": 490.008,
  "diameter": 0.0,
  "visibility": 0.0,
  "visible": false,
  "phase": "before"
 },
 {
  "frame": 5,
  "x": 1203.838,
  "y": 490.008,
  "diameter": 0.0,
  "visibility": 0.0,
  "visible": false,
  "phase": "before"
 },
 {
  "frame": 6,
  "x": 1203.838,
  "y": 490.008,
  "diameter": 0.0,
  "visibility": 0.0,
  "visible": false,
  "phase": "before"
 },
 {
  "frame": 7,
  "x": 1203.838,
  "y": 490.008,
  "diameter": 0.0,
  "visibility": 0.0,
  "visible": false,
  "phase": "before"
 },
 {
  "frame": 8,
  "x": 1203.838,
  "y": 490.008,
  "diameter": 0.0,
  "visibility": 0.0,
  "visible": false,
  "phase": "before"
 },
 {
  "frame": 9,
  "x": 1203.838,
  "y": 490.008,
  "diameter": 0.0,
  "visibility": 0.0,
  "visible": false,
  "phase": "before"
 },
 {
  "frame": 10,
  "x": 1203.838,
  "y": 490.008,
  "diameter": 0.0,
  "visibility": 0.0,
  "visible": false,
  "phase": "before"
 },
 {
  "frame": 11,
  "x": 1203.838,
  "y": 490.008,
  "diameter": 0.0,
  "visibility": 0.0,
  "visible": false,
  "phase": "before"
 },
 {
  "frame": 12,
  "x": 1203.838,
  "y": 490.008,
  "diameter": 0.0,
  "visibility": 0.0,
  "visible": false,
  "phase": "before"
 },
 {
  "frame": 13,
  "x": 1203.838,
  "y": 490.008,
  "diameter": 0.0,
  "visibility": 0.0,
  "visible": false,
  "phase": "before"
 },
 {
  "frame": 14,
  "x": 1203.838,
  "y": 490.008,
  "diameter": 0.0,
  "visibility": 0.0,
  "visible": false,
  "phase": "before"
 },
 {
  "frame": 15,
  "x": 1203.838,
  "y": 490.008,
  "diameter": 0.0,
  "visibility": 0.0,
  "visible": false,
  "phase": "before"
 },
 {
  "frame": 16,
  "x": 1203.838,
  "y": 490.008,
  "diameter": 0.0,
  "visibility": 0.0,
  "visible": false,
  "phase": "before"
 },
 {
  "frame": 17,
  "x": 1203.838,
  "y": 490.008,
  "diameter": 0.0,
  "visibility": 0.0,
  "visible": false,
  "phase": "before"
 },
 {
  "frame": 18,
  "x": 1203.838,
  "y": 490.008,
  "diameter": 0.0,
  "visibility": 0.0,
  "visible": false,
  "phase": "before"
 },
 {
  "frame": 19,
  "x": 1203.838,
  "y": 490.008,
  "diameter": 0.0,
  "visibility": 0.0,
  "visible": false,
  "phase": "before"
 },
 {
  "frame": 20,
  "x": 1203.838,
  "y": 490.008,
  "diameter": 0.0,
  "visibility": 0.0,
  "visible": false,
  "phase": "before"
 },
 {
  "frame": 21,
  "x": 1203.838,
  "y": 490.008,
  "diameter": 0.0,
  "visibility": 0.0,
  "visible": false,
  "phase": "before"
 },
 {
  "frame": 22,
  "x": 1203.838,
  "y": 490.008,
  "diameter": 0.0,
  "visibility": 0.0,
  "visible": false,
  "phase": "before"
 },
 {
  "frame": 23,
  "x": 1203.838,
  "y": 490.008,
  "diameter": 0.0,
  "visibility": 0.0,
  "visible": false,
  "phase": "before"
 },
 {
  "frame": 24,
  "x": 1203.838,
  "y": 490.008,
  "diameter": 0.0,
  "visibility": 0.0,
  "visible": false,
  "phase": "before"
 },
 {
  "frame": 25,
  "x": 1203.838,
  "y": 490.008,
  "diameter": 0.0,
  "visibility": 0.0,
  "visible": false,
  "phase": "before"
 },
 {
  "frame": 26,
  "x": 1203.838,
  "y": 490.008,
  "diameter": 0.0,
  "visibility": 0.0,
  "visible": false,
  "phase": "before"
 },
 {
  "frame": 27,
  "x": 1205.926,
  "y": 487.14,
  "diameter": 0.0,
  "visibility": 0.0,
  "visible": false,
  "phase": "before"
 },
 {
  "frame": 28,
  "x": 1207.253,
  "y": 486.389,
  "diameter": 0.0,
  "visibility": 0.3333,
  "visible": false,
  "phase": "entrance"
 },
 {
  "frame": 29,
  "x": 1208.244,
  "y": 486.159,
  "diameter": 2.164,
  "visibility": 0.6667,
  "visible": true,
  "phase": "entrance"
 },
 {
  "frame": 30,
  "x": 1209.005,
  "y": 486.491,
  "diameter": 8.148,
  "visibility": 1.0,
  "visible": true,
  "phase": "entrance"
 },
 {
  "frame": 31,
  "x": 1209.543,
  "y": 486.678,
  "diameter": 17.188,
  "visibility": 1.0,
  "visible": true,
  "phase": "entrance"
 },
 {
  "frame": 32,
  "x": 1209.741,
  "y": 487.582,
  "diameter": 28.519,
  "visibility": 1.0,
  "visible": true,
  "phase": "entrance"
 },
 {
  "frame": 33,
  "x": 1209.948,
  "y": 488.538,
  "diameter": 41.377,
  "visibility": 1.0,
  "visible": true,
  "phase": "entrance"
 },
 {
  "frame": 34,
  "x": 1209.915,
  "y": 490.226,
  "diameter": 55.0,
  "visibility": 1.0,
  "visible": true,
  "phase": "entrance"
 },
 {
  "frame": 35,
  "x": 1210.073,
  "y": 491.975,
  "diameter": 68.623,
  "visibility": 1.0,
  "visible": true,
  "phase": "entrance"
 },
 {
  "frame": 36,
  "x": 1210.169,
  "y": 493.543,
  "diameter": 81.481,
  "visibility": 1.0,
  "visible": true,
  "phase": "entrance"
 },
 {
  "frame": 37,
  "x": 1210.27,
  "y": 494.98,
  "diameter": 92.812,
  "visibility": 1.0,
  "visible": true,
  "phase": "entrance"
 },
 {
  "frame": 38,
  "x": 1209.723,
  "y": 496.812,
  "diameter": 101.852,
  "visibility": 1.0,
  "visible": true,
  "phase": "entrance"
 },
 {
  "frame": 39,
  "x": 1209.197,
  "y": 498.391,
  "diameter": 107.836,
  "visibility": 1.0,
  "visible": true,
  "phase": "entrance"
 },
 {
  "frame": 40,
  "x": 1208.864,
  "y": 500.393,
  "diameter": 110.0,
  "visibility": 1.0,
  "visible": true,
  "phase": "held"
 },
 {
  "frame": 41,
  "x": 1208.067,
  "y": 502.106,
  "diameter": 110.0,
  "visibility": 1.0,
  "visible": true,
  "phase": "held"
 },
 {
  "frame": 42,
  "x": 1207.786,
  "y": 503.148,
  "diameter": 110.0,
  "visibility": 1.0,
  "visible": true,
  "phase": "held"
 },
 {
  "frame": 43,
  "x": 1206.835,
  "y": 503.826,
  "diameter": 110.0,
  "visibility": 1.0,
  "visible": true,
  "phase": "held"
 },
 {
  "frame": 44,
  "x": 1206.506,
  "y": 504.777,
  "diameter": 110.0,
  "visibility": 1.0,
  "visible": true,
  "phase": "held"
 },
 {
  "frame": 45,
  "x": 1205.012,
  "y": 505.124,
  "diameter": 110.0,
  "visibility": 1.0,
  "visible": true,
  "phase": "held"
 },
 {
  "frame": 46,
  "x": 1205.144,
  "y": 505.699,
  "diameter": 110.0,
  "visibility": 1.0,
  "visible": true,
  "phase": "held"
 },
 {
  "frame": 47,
  "x": 1205.274,
  "y": 505.011,
  "diameter": 110.0,
  "visibility": 1.0,
  "visible": true,
  "phase": "held"
 },
 {
  "frame": 48,
  "x": 1205.026,
  "y": 505.194,
  "diameter": 110.0,
  "visibility": 1.0,
  "visible": true,
  "phase": "held"
 },
 {
  "frame": 49,
  "x": 1204.539,
  "y": 505.663,
  "diameter": 110.0,
  "visibility": 1.0,
  "visible": true,
  "phase": "held"
 },
 {
  "frame": 50,
  "x": 1204.823,
  "y": 505.492,
  "diameter": 110.0,
  "visibility": 1.0,
  "visible": true,
  "phase": "held"
 },
 {
  "frame": 51,
  "x": 1204.683,
  "y": 505.808,
  "diameter": 110.0,
  "visibility": 1.0,
  "visible": true,
  "phase": "held"
 },
 {
  "frame": 52,
  "x": 1204.762,
  "y": 505.677,
  "diameter": 110.0,
  "visibility": 1.0,
  "visible": true,
  "phase": "held"
 },
 {
  "frame": 53,
  "x": 1204.56,
  "y": 506.366,
  "diameter": 110.0,
  "visibility": 1.0,
  "visible": true,
  "phase": "held"
 },
 {
  "frame": 54,
  "x": 1204.933,
  "y": 505.485,
  "diameter": 110.0,
  "visibility": 1.0,
  "visible": true,
  "phase": "held"
 },
 {
  "frame": 55,
  "x": 1204.527,
  "y": 505.733,
  "diameter": 110.0,
  "visibility": 1.0,
  "visible": true,
  "phase": "held"
 },
 {
  "frame": 56,
  "x": 1204.446,
  "y": 505.619,
  "diameter": 110.0,
  "visibility": 1.0,
  "visible": true,
  "phase": "held"
 },
 {
  "frame": 57,
  "x": 1204.28,
  "y": 505.041,
  "diameter": 110.0,
  "visibility": 1.0,
  "visible": true,
  "phase": "held"
 },
 {
  "frame": 58,
  "x": 1202.338,
  "y": 504.746,
  "diameter": 110.0,
  "visibility": 1.0,
  "visible": true,
  "phase": "held"
 },
 {
  "frame": 59,
  "x": 1203.612,
  "y": 504.63,
  "diameter": 110.0,
  "visibility": 1.0,
  "visible": true,
  "phase": "held"
 },
 {
  "frame": 60,
  "x": 1201.52,
  "y": 505.222,
  "diameter": 110.0,
  "visibility": 1.0,
  "visible": true,
  "phase": "held"
 },
 {
  "frame": 61,
  "x": 1203.172,
  "y": 505.277,
  "diameter": 110.0,
  "visibility": 1.0,
  "visible": true,
  "phase": "held"
 },
 {
  "frame": 62,
  "x": 1204.285,
  "y": 504.319,
  "diameter": 110.0,
  "visibility": 1.0,
  "visible": true,
  "phase": "held"
 },
 {
  "frame": 63,
  "x": 1204.751,
  "y": 503.74,
  "diameter": 110.0,
  "visibility": 1.0,
  "visible": true,
  "phase": "held"
 },
 {
  "frame": 64,
  "x": 1204.996,
  "y": 503.758,
  "diameter": 110.0,
  "visibility": 1.0,
  "visible": true,
  "phase": "held"
 },
 {
  "frame": 65,
  "x": 1205.081,
  "y": 503.102,
  "diameter": 110.0,
  "visibility": 1.0,
  "visible": true,
  "phase": "held"
 },
 {
  "frame": 66,
  "x": 1205.303,
  "y": 503.204,
  "diameter": 110.0,
  "visibility": 1.0,
  "visible": true,
  "phase": "held"
 },
 {
  "frame": 67,
  "x": 1205.121,
  "y": 503.743,
  "diameter": 110.0,
  "visibility": 1.0,
  "visible": true,
  "phase": "held"
 },
 {
  "frame": 68,
  "x": 1204.892,
  "y": 503.816,
  "diameter": 110.0,
  "visibility": 1.0,
  "visible": true,
  "phase": "held"
 },
 {
  "frame": 69,
  "x": 1204.906,
  "y": 503.662,
  "diameter": 110.0,
  "visibility": 1.0,
  "visible": true,
  "phase": "held"
 },
 {
  "frame": 70,
  "x": 1204.401,
  "y": 504.246,
  "diameter": 110.0,
  "visibility": 1.0,
  "visible": true,
  "phase": "held"
 },
 {
  "frame": 71,
  "x": 1202.084,
  "y": 505.601,
  "diameter": 110.0,
  "visibility": 1.0,
  "visible": true,
  "phase": "held"
 },
 {
  "frame": 72,
  "x": 1205.579,
  "y": 506.36,
  "diameter": 110.0,
  "visibility": 1.0,
  "visible": true,
  "phase": "held"
 },
 {
  "frame": 73,
  "x": 1206.085,
  "y": 505.547,
  "diameter": 110.0,
  "visibility": 1.0,
  "visible": true,
  "phase": "held"
 },
 {